{
  "fixture_id": "fx_get_orders_ok",
  "tool": "get_orders",
  "match_strategy": "ordered_sequence",
  "sequence_order": 2,
  "recorded_input": {
    "customer_id": 42
  },
  "recorded_response": {
    "status": "success",
    "body": [
      { "id": 122, "status": "DELIVERED" },
      { "id": 123, "status": "PROCESSING" }
    ]
  },
  "provenance": "authored"
}
